{
  "$schema": "./schema/topic-manifest.schema.json",
  "schemaVersion": "1.0",
  "id": "topic001",
  "slug": "common-entrustment",
  "title": "共同委托",
  "subtitle": "",
  "summary": "共同委托用于解释住宅小区中业主如何通过共同决定和有效授权，把特定共有事务交由专业主体统一执行，并使管理权限与忠实、勤勉、公开、监督及退出责任相连接。",
  "releaseStatus": "draft",
  "foundationStatus": "in_review",
  "websiteStatus": "hidden",
  "version": "1.0.0",
  "releaseRecord": "",
  "sourcePackage": "docs/knowledge-production/topic001-release-package-v1.0/README.md",
  "updatedAt": "2026-07-17",
  "objects": [
    "JD001",
    "JD002",
    "JD003",
    "JD004",
    "JD005",
    "JD006",
    "JD009",
    "BK1-JD-026",
    "BK1-GT-001",
    "TPK001-FAQ-001",
    "TPK001-FAQ-002",
    "TPK001-FAQ-003",
    "TPK001-FAQ-004",
    "TPK001-LAW-001",
    "BK1-CASE-003",
    "TPK001-RESEARCH-001"
  ],
  "categoryId": "governance-mechanism",
  "tagIds": ["common-entrustment", "joint-decision", "trustee-performance"],
  "keywords": [
    "共同委托",
    "共同决定",
    "共同管理权",
    "物业服务合同",
    "委托人",
    "受托人",
    "受托责任",
    "忠实义务",
    "勤勉义务",
    "信息公开",
    "共同监督"
  ],
  "popularity": 0,
  "evidence": []
}
